name,foods,score,kind
周黑鸭(小翔哥版),鸭翅、鸭掌、鸡蛋、鹌鹑蛋、猪后腿瘦肉(选加)、猪皮(选加)、花椒/干辣椒/桂皮/山奈/老姜/八角/香叶、生抽/老抽/冰糖/甜面酱、啤酒,8.9,鸡蛋
零失败油条（油饼麻花万能面团）,普通面粉（高筋更好）、牛奶、鸡蛋、盐、酵母、食用油、砂糖（可以不加）、泡打粉（可以不加）,8.9,鸡蛋
会连续吃八个的萝卜馅饼,脆萝卜、面粉、50度温水、鸡蛋、盐、料酒、蚝油、十三香、香油,8.4,鸡蛋
奶油奶酪古早蛋糕,奶油奶酪、牛奶、酸奶、带壳鸡蛋（8个）、玉米油、黄油（椰子油）、低筋粉+玉米淀粉、细砂糖+玉米淀粉+盐、柠檬汁、8寸加高固底方模（边长20CM左右，高度8CM）、香草精（可不加）,8.9,鸡蛋
韩式拌饭,米饭、肥牛卷、胡萝卜、西葫芦、黄豆芽、菠菜、香菇、鸡蛋、泡菜、韩式辣椒、白芝麻、生抽、香油、雪碧、蜂蜜或者白糖,8.3,鸡蛋
超简单的红豆酥,黄油、绵白糖、鸡蛋、低筋面粉、黑芝麻、豆沙馅,1,鸡蛋
「巨好吃牛肉鲜虾馄饨」附馄饨灵魂的虾🦐油制作,牛肉、虾、馄饨皮、葱、盐、生抽、耗油、生姜粉、鸡蛋、虾油、虾油用料如下、虾头、葱、油,8.8,鸡蛋
烤羊肉串,羊肉、生姜末、洋葱、白胡椒粉、孜然粉、鸡蛋、盐、竹签、辣椒粉、孜然粒、熟白芝麻,8.8,鸡蛋
正宗广式经典月子餐——猪脚姜,猪蹄、鸡蛋、姜、甜醋,8.6,鸡蛋
网红EGGDROP芝士厚蛋烧三明治🥪『平底锅美食』,厚吐司、黄油、鸡蛋、牛奶、盐、培根/午餐肉、芝士、装饰、美乃滋(沙拉酱)、黄芥末酱(选)、欧芹碎(选),8.5,鸡蛋
吐司这样吃-一周减脂三明治不重样,吐司片、鸡蛋、生菜、芝士片、胡萝卜、火腿片、鸡胸肉、金枪鱼罐头、虾仁、颗粒芥末酱、低脂沙拉酱、番茄酱、咸蛋黄酱,8.6,鸡蛋
一口一个超过瘾的珍珠丸子,糯米（最好过夜泡好）、肉馅、葱花、鸡蛋、蚝油、生抽、香油、十三香、糖、淀粉,8.5,鸡蛋
【一只番茄饭】,番茄、土豆、胡萝卜、火腿、腊肠、青豆、玉米粒、大米、黑胡椒、食用油、生抽、盐、鸡蛋、海苔碎、鸡蛋、糖、色拉油、牛奶、低筋面粉、柠檬汁、绵白糖,8.7,鸡蛋
快手减脂餐❗️爆好吃的凉拌鸡丝荞麦面,荞麦面、鸡胸肉、鸡蛋、黄瓜、葱花蒜末、小米椒,8.4,鸡蛋
剩米饭的华丽转身-米饭披萨,剩米饭、盐、鸡蛋、马苏里拉奶酪、黑胡椒粉、番茄酱、红色：圣女果、红色：火腿肠、绿色：青柿子椒、黄色：玉米粒、白色：洋葱,8.8,鸡蛋
土豆虾球,土豆、面包糠、面粉、盐、黑胡椒、鸡蛋、虾、黄瓜,0,鸡蛋
好吃不上火的【绵密型】酸奶蒸蛋糕～完胜电饭锅版,鸡蛋、酸奶、玉米油、细砂糖、细砂糖、低粉、柠檬汁,8.4,鸡蛋
宝宝10个月辅食：妈妈都觉得好吃的虾仁蒸糕,鸡蛋🥚、面粉、虾仁🍤、柠檬汁,8.4,鸡蛋
成长快乐红糖珍珠蛋挞,蛋挞皮、纯牛奶、鸡蛋、细砂糖、红糖、珍珠、奶茶包,9.0,鸡蛋
六寸(6寸)戚风蛋糕(掌握这几点，做戚风就跟煮米饭一样简单),鸡蛋、牛奶、细砂糖、低筋面粉、玉米油、柠檬汁、玉米淀粉、盐、👇8⃣️寸方子、鸡蛋、玉米油、牛奶、细砂糖、低筋面粉、柠檬汁或白醋、盐、玉米淀粉、烘烤时间温度：、、👇以下操作是6个🥚做两个六寸,8.6,鸡蛋
超简单&简易炸猪排,猪里脊肉、鸡蛋、面包糠、葱、盐、料酒、味精、白胡椒粉、蕃茄酱、淀粉,8.9,鸡蛋
“烧伤”的奶酪蛋糕Burntcheesecake,奶油奶酪、马斯卡彭奶酪、鸡蛋、细砂糖、蜂蜜、淡奶油、低筋面粉,8.8,鸡蛋
第二代手抓饼转世，让你爱得死去活来,1.手抓饼皮、鸡蛋（土鸡蛋）、榨菜丁、盐、白糖、鸡精、2.手抓饼皮、鸡蛋（土鸡蛋个小）、青椒、榨菜丁、、盐、白糖、鸡精、3.馅儿,8.1,鸡蛋
简易蛋糕(胚），拯救屡败星人（8寸）,鸡蛋（一般个头5-6个，问多少个蛋的真是败给你们了，没有称吗😒）、面粉或低筋面粉、玉米油（可以换成任意的可食用油，不要再问花生油，大豆油，橄榄油各种油行不行😓）、白砂糖、牛奶（牛奶的多少主要看烫面的状态，如果烫太干，就多加牛奶或者开始，正常加到200克还是太稠的话，可以先加了蛋黄再看状态调）、开水一壶，步骤12，水浴用,8.6,鸡蛋
一吃就上瘾的巧克力粑粑糕,鸡蛋、牛奶、玉米油、糖、可可粉、糯米粉、巧克力豆,0,鸡蛋
红烧狮子头四喜丸子,猪肉、鸡蛋、料酒、生抽、盐、糖、淀粉、蚝油、葱、姜、老抽、胡萝卜、莲藕、大葱、小葱、鲜香菇、豆腐、八角,8.3,鸡蛋
【生酮低碳】巴斯克式烤芝士蛋糕简单粗暴快手0失败,奶油奶酪、酸奶油/淡奶油、鸡蛋、代糖2倍甜、香草精,8.7,鸡蛋
🌸鸡蛋花篮沙拉花－增强免疫力.低卡减脂🌸,鸡蛋、蟹棒、胡萝卜丁、玉米粒、豌豆粒冷冻食品、小葱（蒜苔）、萝卜苗（西兰花苗）、盐、蛋黄酱（可以酱油、鸡精等代替）、黑胡椒,8.5,鸡蛋
焖煎豆腐,嫩豆腐、鸡蛋、蒜苗、蒜、干葱头、小米辣、白砂糖、生抽、蚝油、白胡椒粉、清水、油,7.9,鸡蛋
天然果蔬戚风蛋糕,鸡蛋、牛奶、菠菜汁、南瓜泥、玉米油、低筋面粉、砂糖、盐,8.7,鸡蛋
最简单的红烧排骨【你肯定会！！！】,排骨、鸡蛋、生抽、白糖、黄酒、姜片、香叶、桂皮,8.3,鸡蛋
香葱肉松蛋糕卷（这是一个步骤超级详细的视频菜谱）,鸡蛋、低筋面粉、白砂糖、、玉米油、盐、白醋或柠檬汁、牛奶、香葱、肉松、沙拉酱,8.7,鸡蛋
可以当主食的爽口凉拌菜——粉丝菠菜,粉丝、菠菜、鸡蛋、魔芋丝、小米椒、蒜、芝麻、辣椒粉、生抽、醋、白糖、盐、植物油,0,鸡蛋
柠檬酱—酸甜可口易上手版（消耗柠檬的好方法）,柠檬（中等偏大）、鸡蛋、细砂糖、黄油,8.6,鸡蛋
美味卤一锅,鸡蛋、鸡爪、鸡脖、藕、生抽、姜、料酒、冰糖、香料、糖、葱、盐,8.3,鸡蛋
停不下来快手韩式拌杂菜,鸡蛋、胡萝卜、菠菜、干香菇、干木耳、洋葱、猪肉糜、生姜、料酒、粉条、豆芽、酱汁、酱油、芝麻油、糖（不爱甜放半勺）、盐、芝麻、日式拌饭芝麻海苔、黑胡椒,8.3,鸡蛋
黄金蝴蝶虾,虾、面包糠、淀粉、鸡蛋、、料酒、盐,8.6,鸡蛋
原味古早蛋糕,鸡蛋、低筋面粉、细砂糖、色拉油、牛奶、盐、柠檬汁,8.2,鸡蛋
韩剧中的鸡蛋卷,鸡蛋、火腿（可不加）、胡萝卜丁（可不加）、葱花、盐、生粉,7.8,鸡蛋
全麦麦满分饼胚100%全麦,全麦粉、盐、砂糖、鲜酵母(干酵母)、水、鸡蛋、黄油（可不放）,8.6,鸡蛋
酱香土豆火腿烘蛋,土豆、火腿肠、鸡蛋、大蒜、韩式辣酱、甜面酱、番茄酱、孜然粉、白糖、食盐,0,鸡蛋
快手的网红basquecheesecake巴斯克焦芝士蛋糕,奶油奶酪、淡奶油、糖、鸡蛋、盐、香草精,8.4,鸡蛋
鸡蛋炒米粉，正确泡发干米粉，不碎、不坨、不粘锅、口感Q弹,米粉、花生油（炟米粉）、盐（炟米粉）、鸡蛋、绿豆芽、小葱、花生油、生抽,8.4,鸡蛋
牛奶巧克力吐司,高筋面粉、砂糖、盐、可可粉、奶粉、鸡蛋、牛奶、黄油、新鲜酵母、巧克力豆（耐高温）,8.7,鸡蛋
连着3天儿子都点名要吃的晚餐，剪刀面,鸡蛋、西红柿、火腿肠、面粉、菠菜,8.0,鸡蛋
邻居抢着来我家吃土豆香肠炒饭，原来这么香！,米饭、鸡蛋、香肠、土豆、生抽、老抽、蚝油、白糖,8.1,鸡蛋
🍊橙香戚风～吃了我的它忘了那个他（详细多图）,鸡蛋（带壳55-60克）、低筋面粉、玉米淀粉、玉米油、鲜榨橙汁、盐、蛋黄用糖、橙皮屑、橙皮屑用糖、蛋白打发用糖,8.8,鸡蛋
虎皮蛋（爱吃卤鸡蛋的不容不过～）,鸡蛋、食用油、白糖、盐、老抽,8.1,鸡蛋
可以带出去野餐的釜山饭团  ||胡萝卜、鸡蛋饼、火腿等秘制而成,小产地五丰稻花香五常大米、鸡蛋、火腿、胡萝卜、芝麻、香油、盐、寿司醋,17,鸡蛋
比饭店好吃的鸡蛋粉皮,鸡蛋、粉皮、水、盐、生抽、蚝油、葱姜蒜末、香菜、老抽、干辣椒、青椒、八角、花椒、木耳,8.3,鸡蛋
超级解馋的小酥肉,鸡蛋、麻椒、盐、料酒、胡椒粉、猪肉、淀粉、海鲜酱油,8.2,鸡蛋
【台式卤肉饭】最地道的卤肉饭，4步就搞定！,五花肉、鸡蛋、蒜末、红葱头、油、酱油膏、五香粉、白胡椒粉、黄冰糖、米酒、水,8.6,鸡蛋
蔓越莓曲奇•香而不腻、酥脆微甜（减糖版宝宝零食）,黄油（总统无盐）、糖粉、鸡蛋、蔓越莓干、低筋面粉,8.7,鸡蛋
小生煎包子,鸡蛋、韭菜、粉丝、生抽、猪油、饺子皮、盐,8.1,鸡蛋
简单易做的芒果千层盒子,鸡蛋、低筋面粉、玉米油、牛奶、糖粉、淡奶油、糖粉（奶油用）、芒果或其他水果,8.4,鸡蛋
做了几十个，零失败戚风蛋糕,6寸戚风用量：、常温牛奶、粟米油(玉米油)、低筋面粉、鸡蛋（60g以上一个)、柠檬汁、细砂糖、盐(步骤有写放)、8寸戚风用量：、常温牛奶、粟米油(玉米油)、低筋面粉、鸡蛋(60g以上一个)、细砂糖、盐、柠檬汁、10寸戚风用量：,8.3,鸡蛋
特别适合夏天喝的丝瓜菌菇汤，汤鲜味美，清爽开胃又解腻！,丝瓜、海鲜菇、鸡蛋、小葱、盐、食用油、枸杞,0,鸡蛋
超快零失败的蒸鸡蛋羹,鸡蛋、温水、盐、醋、香油,8.0,鸡蛋
给肉都不换的糖醋豆腐‼️外脆里嫩，巨下饭‼️,豆腐、淀粉、葱花、糖、醋、番茄酱、生抽、盐、鸡蛋、蚝油、老抽、蒜末,8.2,鸡蛋
零失败戚风蛋糕(8寸),母鸡蛋、纯牛奶、玉米油、低筋面粉、柠檬汁、细砂糖（蛋黄）、细砂糖（蛋清）,8.6,鸡蛋
韩式拌饭,米饭、菠菜、西葫芦、香菇（我用杏鲍菇代替了）、鸡蛋、胡萝卜、韩国辣酱（清净园）、白糖、白醋、香油（拌饭酱用）、蒜末、雪碧、白芝麻、香油（涂锅底用）,8.3,鸡蛋
巧克力酥皮泡芙ChocolatePuff,【酥皮部分】、黄油、糖粉、低筋面粉、可可粉、【泡芙部分】、黄油、纯净水、盐、糖、低筋面粉、可可粉、鸡蛋,8.6,鸡蛋
酸汤面,鸡蛋、青菜、挂面、白芝麻、小葱、蒜,7.8,鸡蛋
酥脆鲜虾锅贴,大虾、猪肉末、鸡蛋、饺子皮、香葱、姜、蚝油、生抽、花椒油、香油、淀粉、黑胡椒和盐、料酒、五香粉,8.4,鸡蛋
面包机做奶香手撕吐司,高筋面粉、奶粉、鸡蛋、细砂糖、盐、炼乳、牛奶、黄油、耐高糖酵母,8.6,鸡蛋
手把手教电饭煲蛋糕,鸡蛋、低筋面粉、油、牛奶/水、糖,0,鸡蛋
陈香照烧龙利鱼便当,龙利鱼、芦笋、鸡蛋、喜欢的水果、米饭、生菜、恒顺香醋三年陈、酱油、清酒、味淋、蜂蜜、淀粉、姜片、植物油、盐、辣椒、红椒粉、黑白芝麻,8.6,鸡蛋
超完美配比的泡芙面糊&churros吉事果面糊（1个配方2种点心）,水、全脂牛奶、盐、细砂糖、无盐黄油、中筋面粉、鸡蛋、churros吉事果蘸料：、肉桂粉、细砂糖、食用油（油炸用）、牛巧或黑巧、淡奶油、巴旦木碎,8.6,鸡蛋
做一次就成功的：鸡蛋小饼干💕小时候的味道💕,鸡蛋、低筋面粉、细砂糖、柠檬汁,8.2,鸡蛋
吃不到膻味的比烧烤更好吃的孜然羊肉🐏,油、辣椒粉、孜然粉、胡椒粉、花椒粉、盐、生抽、料酒、耗油、淀粉、白芝麻、鸡蛋、小葱、姜、香菜,8.4,鸡蛋
超快速软绵绵奶香吐司,高筋面粉（王后吐司粉）、奶粉、细砂糖、盐、酵母、鸡蛋、牛奶、淡奶油、炼奶、黄油、450G吐司盒子,8.4,鸡蛋
懒人水煎包，不用发面,韭菜、鸡蛋、香菇、胡萝卜、木耳、粉条、盐、耗油、鸡精、生抽、小磨香油、十三香，五香粉、饺子皮,8.1,鸡蛋
牛奶鸡蛋醪糟冬日里最爱的甜品汤,全脂牛奶、鸡蛋、小苏打、奶粉（可选）、醪糟、黑芝麻、坚果、果脯,8.3,鸡蛋
家庭版肉夹馍,五花肉、面粉、酵母、鸡蛋、桂皮、花椒、姜、香叶、干橘皮、干辣椒、八角、冰糖、大葱、白糖、老抽、生抽、蚝油、盐、香菜、青椒,8.3,鸡蛋
【正经料理】外表坚强内心柔软的炸鲜牛奶,牛奶、淀粉、绵白糖、面粉、鸡蛋、面包糠,1,鸡蛋
巧克力分蛋海绵蛋糕,鸡蛋（带壳60g）、细砂糖、低筋面粉、黄油、可可粉、牛奶、水饴,8.7,鸡蛋
酥皮泡芙新手一次成功（附卡仕达酱做法）,【酥皮】、黄油（必须动物的！）、糖粉（不可替换）、低筋面粉、【泡芙】、牛奶、黄油（必须动物的！）、鸡蛋（室温）、白砂糖、低筋面粉、【卡仕达酱】、鸡蛋黄！、糖、牛奶、低筋面粉、卡仕达酱➕打发好的淡奶油100ml，混合均匀,8.4,鸡蛋
肉末蒸蛋羹：厨房小白都可以蒸出好吃的鸡蛋羹哟,鸡蛋、温水、盐,8.5,鸡蛋
超好吃西葫芦蒸饺,中筋粉、开水、冷水、西葫芦、鸡蛋、虾皮或海米、盐、色拉油、香油、鸡精、五香粉或花椒粉、葱花,8.4,鸡蛋
油条(视频版～更直观),中筋面粉、鸡蛋、盐、小苏打、无铝泡打粉、玉米油、凉水,8.5,鸡蛋
不节食也能让你瘦瘦瘦的减脂早餐（四）,菠菜、鸡蛋、玉米面,0,鸡蛋
古早味蛋糕-材料超简单味道不一般/水润零毛孔,低筋面粉、玉米油、牛奶、鸡蛋、细砂糖、盐、香草精、白醋或柠檬汁,8.3,鸡蛋
卤蛋最好吃做法！抢手的早餐，全家必备,鸡蛋、啤酒、盐、冰糖(白糖）、老抽、生抽、味极鲜、调料,0,鸡蛋
不需要奶油的烤蛋挞,蛋挞皮、牛奶、白糖、鸡蛋,8.3,鸡蛋
自制0难度寿喜锅关东煮,汤底制作、干海带、干香菇、萝卜、胡萝卜、苹果、木鱼花、大葱（葱白）、生抽或鱼露、蚝油、料酒或米酒、配菜、牛肉片、乌冬面、虾、娃娃菜、豆腐、玉米、豆芽、金针菇、魔芋、大葱、生鸡蛋,0,鸡蛋
家庭版小酥肉,花椒、鸡蛋、糖、盐、料酒、猪肉、红薯淀粉、五香粉、酱油,8.3,鸡蛋
等待45分钟吧，就能得到超松软的酵母版司康了,高筋面粉、黄油、细砂糖、盐、酵母、牛奶、鸡蛋、熟黑芝麻、全蛋液,8.6,鸡蛋
黄金脆皮炸鸡腿（空气炸锅版）“咔吃～唔～”,鸡腿、鸡蛋、糖、盐、料酒、黑胡椒粉、蒜粉、洋葱粉、玉米淀粉、植物油,8.4,鸡蛋
凉拌粉丝菠菜,菠菜、粉丝、鸡蛋、花生、熟白芝麻、蒜、蚝油、生抽、醋、糖、盐、香油,8.3,鸡蛋
不轻易外传的饺子馅秘方,猪肉、胡萝卜、玉米、鸡蛋、干香菇、干木耳、芹菜、酱油、蚝油、料酒、老抽、油、盐、五香粉、饺子皮,8.5,鸡蛋
美味海苔肉松小贝,牛奶（或水）、玉米油、细砂糖、鸡蛋、低筋面粉、玉米淀粉、柠檬汁或醋、沙拉酱、海苔肉松,8.2,鸡蛋
草莓千层，平底锅就能做，不用烤箱超简单,鸡蛋、黄油、奶油、低筋面粉、糖、纯牛奶、草莓,8.5,鸡蛋
苦瓜炒鸡蛋,苦瓜、鸡蛋、盐、味精、菜籽油,0,鸡蛋
巨美味的椒盐小酥肉❗秒杀火锅店，外酥里嫩❗,里脊肉、鸡蛋、玉米淀粉、普通面粉、水、椒盐➕辣椒面➕白芝麻,8.3,鸡蛋
超简单巨好吃·零失败🔥巴斯克烤芝士蛋糕(6寸),奶油奶酪、淡奶油、细砂糖、蛋黄（室温）、鸡蛋（室温）、低筋面粉或玉米淀粉、香草精或柠檬汁、模具：6寸圆模,8.4,鸡蛋
家庭版炒合菜【绿豆芽粉条炒鸡蛋】,绿豆芽、粉条、鸡蛋、韭菜、葱、油、盐、姜、鸡精、生抽、老抽、红辣椒,8.3,鸡蛋
65%全麦吐司王后粗麸/粗粒全麦粉无奶低糖低油也可以很松软的粗粒全麦吐司,全麦粉、水（泡全麦粉）、高粉、红糖、水、黑芝麻、鲜酵母（或干酵母）、盐、鸡蛋（1颗）、黄油,8.5,鸡蛋
简单快速的海绵纸杯蛋糕,低筋面粉、鸡蛋、细砂糖、蜂蜜、牛奶、无盐黄油,8.6,鸡蛋
超简单的香蕉溶豆（无糖无奶粉版）,鸡蛋、香蕉泥、玉米淀粉,8.4,鸡蛋
超细腻绵软❗️古早蛋糕,鸡蛋、玉米油、牛奶、低筋面粉、细砂糖、柠檬汁,8.4,鸡蛋
油条,面粉、鸡蛋、盐、泡打粉、小苏打、猪油、水,8.4,鸡蛋
『糕』东北炉果,普通面粉、玉米油80克、泡打粉5克、鸡蛋2个,1,鸡蛋
开胃酸辣汤,番茄、鸡蛋、火腿肠、木耳、老抽、盐、水淀粉、香菜、金针菇、白胡椒粉、醋、生抽、酱油、,6,鸡蛋
烤箱（电饭煲）通用8寸戚风蛋糕【步骤超详细】（超简单）,鸡蛋、牛奶、无味的油。（什么油都可，看你喜不喜欢那个味道，比如花生油）、细砂糖（蛋黄）、细砂糖（蛋白）、低筋面粉,8.5,鸡蛋
生日面,胡萝卜、鸡蛋、虾、香菇、丸子、青菜、面、西蓝花,8.4,鸡蛋
空气炸锅戚风蛋糕（6寸超详细打蛋/脱模步骤）,牛奶、玉米油、细砂糖（蛋黄用）、低筋面粉、鸡蛋、细砂糖（蛋白用）、柠檬汁/香草精/醋（选用）、锡纸,8.5,鸡蛋
零失败~流心炸鲜奶,牛奶、细砂糖、玉米淀粉、炼乳（没有可以不用）、鸡蛋、玉米淀粉、面包糠,8.2,鸡蛋
零失误的6寸古早蛋糕,鸡蛋、玉米油、牛奶、细砂糖、柠檬汁或白醋、低筋面粉、玉米淀粉,8.1,鸡蛋
芝士肉松吐司卷,吐司、沙拉酱、肉松、马苏里拉芝士、油、鸡蛋、葱花,8.5,鸡蛋
菠萝咕咾肉（少油版）,梅花肉、菠萝、鸡蛋、甜椒、白胡椒粉、盐、生抽、淀粉、五香粉、料酒、小苏打、面粉、生姜粉、油、糖醋汁用量⬇️、蕃茄酱、白醋、淀粉、白糖、水,8.3,鸡蛋
香煎豆腐（好吃到姥姥家）,豆腐（不是盒装）、鸡蛋、蒜瓣、生抽、蚝油、白糖、葱、胡椒粉、小米椒、清水,8.2,鸡蛋
虾仁的最高境界——虾枣,活虾、盐、鸡蛋、十三香和白胡椒、面粉、肥肉丁,0,鸡蛋
奶香手撕面包吐司，超简单！面包机+松下蒸烤箱,冷藏鸡蛋、盐、细砂糖、牛奶、奶粉、高筋面粉、干酵母、黄油,8.4,鸡蛋
蒸水蛋,鸡蛋、盐、酱油、油、温水、葱花,8.0,鸡蛋
香煎老豆腐,豆腐、生抽、蚝油、鸡蛋、白糖,8.3,鸡蛋
快手早餐～自制油条（酵母版，不含泡打粉、膨松剂）,普通面粉、食用油、鸡蛋、牛奶、酵母、盐,8.1,鸡蛋
起酥火腿面包（手抓饼版，免和面）,鸡蛋、手抓饼、小葱、芝麻、沙拉酱、火腿肠,8.4,鸡蛋
葱花鸡蛋饼,鸡蛋、面粉、葱花、盐、水,7.6,鸡蛋
无糖无油胡萝卜蛋糕，烤箱版VS蒸锅版，你pick谁？,胡萝卜、香蕉、燕麦、鸡蛋、酸奶、坚果、椰子片、希腊酸奶、肉桂粉、海盐、泡打粉,8.5,鸡蛋
韩式炸鸡,鸡蛋、面粉、番茄酱、大蒜、辣椒酱、盐、牛奶、淀粉、水、糖、芝麻、鸡翅、蒜,8.2,鸡蛋
减脂-无油土豆鸡胸肉蔬菜饼减脂主食简单易做,鸡胸肉、胡萝卜、玉米粒、土豆、洋葱、鸡蛋、面包糠,0,鸡蛋
低糖超柔软全麦面包|附多种花样吃法,金像牌全麦粉、金像牌面包用小麦粉、鸡蛋、牛奶、白糖、盐、干酵母、无盐黄油,8.6,鸡蛋
几个小诀窍，教你炸出香气扑鼻的盐酥鸡🍗，简单易做、零失误。,鸡腿肉、鸡蛋、糖、盐、蒜、胡椒粉、辣椒粉、淀粉,0,鸡蛋
香葱肉松蛋糕卷,鸡蛋、牛奶、玉米油、糖、柠檬汁(白醋）、香葱、肉松、沙拉酱、低筋面粉,8.4,鸡蛋
面包十五分钟手套膜及拉丝秘笈(附七岁儿童终极版),A面粉(我用中筋粉蛋白质含量9克)、A牛奶(高筋粉用180-200ml左右)、A鸡蛋、A糖、A酵母(热天建议使用2～3克)、A盐(混合材料时盐不要和酵母放置在一处)、B黄油、B橄榄油(其他油也行)、如果你的面粉蛋白质含量比我们家的高，每高1克请多添加8～10ml牛奶、选择后盐法的请勿先加盐，第15步再添加盐。,9.2,鸡蛋
美的面包机懒人拉丝面包,面包桶，小碗1个，面包机量勺，普通勺子1个，锡纸1张、牛奶（夏冷冬温）、鸡蛋、白砂糖（对角放）、盐（对角放）、高筋面粉（新良）、奶粉（可选）、耐高糖干酵母（安琪，舒可曼均可）、黄油/植物油、葡萄干，蔓越莓干，坚果等,8.5,鸡蛋
非常蓬松的大油条（零失败）,面粉（普通）、鸡蛋、无铝泡打粉、小苏打、油条蓬松剂（各大超市有卖）、温水、盐、食用油,8.5,鸡蛋
我目前最爱的巧克力蛋糕，出现了！,低筋面粉、可可粉、牛奶、鸡蛋、香草精、细砂糖、泡打粉、盐、黄油,8.3,鸡蛋
纸杯蛋糕🧁,鸡蛋、低筋面粉、细砂糖、牛奶、玉米油、柠檬、淡奶油,8.5,鸡蛋
软到不知所措的牛奶卷,金像高粉、细砂糖、金燕子耐高糖酵母、鲜牛奶、金像高粉、雀巢奶粉、金燕子耐高糖酵母、细砂糖、盐、鸡蛋、鲜牛奶、安佳黄油、上下管165度18分钟（8分钟左右时加盖锡纸）,8.7,鸡蛋
空气炸锅紫薯球,鸡蛋、牛奶、紫薯、手抓饼、炼乳、黑芝麻,0,鸡蛋
养生健脾利胃🌸山药小饼🌸,普通面粉、山药、鸡蛋、白糖、酵母、黄油、奶粉,8.3,鸡蛋
俄式提拉米苏蛋糕，成功率极高的烘焙甜品,黄油、细砂糖、蜂蜜、小苏打、鸡蛋、低筋面粉、可可粉、淡奶油、细砂糖,8.3,鸡蛋
东北老式无水蛋糕,鸡蛋、玉米油、白糖、低筋面粉,8.3,鸡蛋
超详细的瑞士卷奶油蛋糕卷原味蛋糕卷的制作方法饱满不掉皮不开裂（附模具换算方法）,鸡蛋、低粉、植物油、纯牛奶、细砂糖、玉米淀粉、白醋或者柠檬汁,8.3,鸡蛋
淡奶油面包,牛奶、奶油、鸡蛋、细砂糖、盐、高筋面粉、酵母,8.5,鸡蛋
日本小嶋留味老师（RumiKojima）的经典海绵蛋糕,鸡蛋、细砂糖、水饴、低筋面粉、黄油、牛奶,8.4,鸡蛋
0失败香酥杏鲍菇,杏鲍菇、鸡蛋、面粉、淀粉、盐、鸡精、十三香、清水、油,8.1,鸡蛋
电饭煲蛋糕,鸡蛋、纯牛奶、白砂糖、面粉、食用油、葡萄干或水果干,8.4,鸡蛋
棒棒糖蛋糕零失败-满模-抗折腾,鸡蛋、细砂糖、黄油、低筋面粉、泡打粉、黑巧克力币、糖珠,8.5,鸡蛋
星月蒸糕,紫薯、中筋面粉、铁棍山药、鸡蛋,0,鸡蛋
肉末豆腐蒸蛋,肉末、鸡蛋、嫩豆腐、生抽、盐、料酒、蚝油、老抽、白糖、十三香,8.1,鸡蛋
洋葱酥卤肉饭,五花肉、洋葱、油菜、鸡蛋、葱、姜、蒜、八角、冰糖、食盐、老抽、绍兴黄酒或者加饭酒、香菇,8.6,鸡蛋
鸡蛋酱拌面,面条、鸡蛋,5,鸡蛋
戚风蛋糕（细腻无颗粒）,鸡蛋、柠檬汁、细砂糖、牛奶、玉米油、低筋面粉,8.3,鸡蛋
超简单古早蛋糕（8寸圆）,低筋面粉、细砂糖、牛奶、玉米油、鸡蛋、盐、柠檬汁/白醋,8.4,鸡蛋
蛋白果蔬溶豆（史上最详细全视频版）,鸡蛋、果蔬泥、玉米淀粉、婴儿奶粉、柠檬汁、细砂糖,8.3,鸡蛋
古早蛋糕宝宝辅食食谱,低筋面粉、鸡蛋、牛奶、玉米油、糖、玉米淀粉、柠檬,8.3,鸡蛋
『家庭版炒合菜』,鸡蛋、韭菜、红薯粉丝、绿豆芽or黄豆芽、生抽、老抽、蚝油、盐、糖、鸡精、小米椒、蒜,7.7,鸡蛋
紫薯山药饼,紫薯、铁棍山药、面粉、牛奶、鸡蛋,0,鸡蛋
高颜值海苔饭团,寿司用海苔、午餐肉、鸡蛋、生菜、美乃滋、蕃茄酱、熟白芝麻,8.1,鸡蛋
刷爆朋友圈的黄瓜贴面玉子烧,牛奶、盐、鸡蛋、酱油、小黄瓜,8.0,鸡蛋
超厚梦龙卷，可可卷不消泡的秘决,可可粉、热水、鸡蛋、牛奶、玉米油、低筋面粉、细砂糖、淡奶油、细砂糖、好时巧克力酱、嘉利宝54%、夏威夷果仁,8.4,鸡蛋
蛋挞～挞水滑嫩的㊙️密～蛋挞皮的选择,鸡蛋、细砂糖、牛奶、淡奶油、炼乳、低筋面粉、蛋挞皮,8.4,鸡蛋
韭菜盒子（超好吃）,韭菜、虾皮、80-90度水、鸡蛋、盐、面粉、虾仁、油、十三香、鸡精,8.1,鸡蛋
糖醋鸡胸,鸡胸肉、番茄酱、盐、糖、鸡蛋、淀粉、面粉、胡椒粉、醋,8.2,鸡蛋
空气炸锅做纸杯蛋糕,鸡蛋、低筋面粉、牛奶、玉米油、细砂糖,8.3,鸡蛋
超软的奶香红豆沙面包,高筋面粉（白燕）、低筋面粉（新良）、酵母、白糖、盐、鸡蛋、纯牛奶、黄油、蛋黄、红豆沙馅、芝麻,8.4,鸡蛋
私房菜-猪肉玉米锅贴,鸡蛋、猪肉末、姜末、葱末、玉米粒、黑白芝麻、花椒粉、胡椒粉,0,鸡蛋
麻薯面包（木薯淀粉，无需预拌粉，超简单！）,木薯淀粉、牛奶、玉米油、鸡蛋、高筋面粉、糖,8.2,鸡蛋
零失败酥脆小油条（高筋面粉）,高筋面粉、水（面粉牌子不同吸水性不同，酌情添加水量）、鸡蛋、无铝泡打粉、小苏打、油、盐,8.5,鸡蛋
平底锅吐司培根披萨快手早餐,鸡蛋、吐司、马苏里拉、培根、豌豆、芝士粉,8.3,鸡蛋
满屋飘香，口口都是满足——酥松香甜的蔓越莓蜜豆司康,低筋面粉、细砂糖、盐、泡打粉、无盐黄油、鸡蛋、牛奶、蔓越莓、红蜜豆,8.1,鸡蛋
