name,foods,score,kind
戚风蛋糕（细腻无颗粒）,鸡蛋、柠檬汁、细砂糖、牛奶、玉米油、低筋面粉,8.3,烘焙
桃酥,猪油、绵白糖、蛋黄、中筋面粉、盐、玉米淀粉、小苏打、泡打粉,8.7,烘焙
鸡蛋小饼干（全蛋版）,鸡蛋（一个50克左右）、柠檬汁、细砂糖、低筋面粉、奶粉、玉米淀粉、玉米油、盐,8,烘焙
柔软细腻，浓郁香气的巧克力古早味蛋糕,鸡蛋、低筋面粉、巧克力、玉米油、牛奶、细砂糖、可可粉、柠檬汁、巧克力豆,6,烘焙
外酥里糯✨网红粑粑糕㊙️一次解锁三种口味,牛奶、鸡蛋、糯米粉、糖、玉米油、可可粉、抹茶粉、可可豆、杏仁片、蔓越莓干,2,烘焙
巧克力千层蛋糕,低筋面粉、可可粉、玉米淀粉、牛奶、鸡蛋、细砂糖、玉米油、〈二〉巧克力奶油、65%黑巧克力、淡奶油（溶化黑巧克力用）、淡奶油、糖粉或细沙糖,8.2,烘焙
美的面包机懒人拉丝面包,面包桶，小碗1个，面包机量勺，普通勺子1个，锡纸1张、牛奶（夏冷冬温）、鸡蛋、白砂糖（对角放）、盐（对角放）、高筋面粉（新良）、奶粉（可选）、耐高糖干酵母（安琪，舒可曼均可）、黄油/植物油、葡萄干，蔓越莓干，坚果等,8.5,烘焙
巧克力趣多多饼干,黄油、糖粉、蛋黄、可可粉、低筋粉、玉米淀粉、泡打粉、耐烘烤巧克力豆,0,烘焙
零失败花纹超级立体的黄油曲奇,开始做之前请一定认真看看小贴士，成败在此一举，在我这个方子里，特别特别重要的是黄油软化的程度，太软花纹不成型，太硬挤到手抽筋。、【温馨提示：曲奇烤的时候会比你原来挤的体积稍微大一点，所以，挤的时候不要挤太大哦，变大一点很正常，不可能烤完后还跟挤出的大小一样】、❣️❣️❣️糖粉可以根据自己口味适当增减，其他可以变动的地方上面都写了，没写的要么就是不能变动，要么就是我没尝试过，要换这换那的，自己尝试一下哈，但改完后的口感我由于没尝试过，自然是不知道的，你们自己做实验吧！！！、黄油、糖粉、盐、蛋清、低筋面粉、高筋面粉、南杏仁粉、黄油、糖粉、盐、蛋清、低筋面粉、高筋面粉、南杏仁粉、抹茶粉、黄油、糖粉、盐、蛋清、低筋面粉、高筋面粉、可可粉、南杏仁粉、温馨提示：步骤里的图我是用的三倍的量,8.4,烘焙
芒果千层蛋糕，100%成功告别煎皮无能,面皮：、黄油、细糖、鸡蛋、牛奶、低粉、奶油夹馅：、淡奶油、糖粉、芒果、吉利丁片,8.0,烘焙
黄桃蛋糕卷（小四卷）,食用油、牛奶、蛋黄、低粉、蛋白、细砂糖、柠檬汁、玉米淀粉、黄桃、淡奶油、细砂糖,8.1,烘焙
北海道吐司（直接法）~,牛奶、全蛋液、（蓝风车）淡奶油、细砂糖、盐、（雀巢）奶粉、（美玫）低筋面粉、（金像）高筋面粉、（法国燕子）干酵母、450g（三能）吐司模具,8.2,烘焙
铜锣烧(直径半扎长的饼16张左右),低筋粉、鸡蛋、糖、盐、玉米油、全脂奶、泡打粉,0,烘焙
芝士古早蛋糕,芝士、低筋面粉、玉米油、牛奶、盐、细砂糖、蛋黄、蛋白、奶粉、香草膏,8.0,烘焙
完美同心正圆荷包蛋,鸡蛋、小奶锅、熔化锅或大号汤勺,8.2,烘焙
只需一次发酵的超软吐司（附面包机揉手套膜攻略）,高筋面粉、牛奶、水、全蛋液、奶粉、炼乳、糖粉（对，糖粉，不是砂糖噢）、盐、酵母粉、黄油,8.3,烘焙
瘦了八斤，我的自制全麦面包合集,新良全麦面包粉、酵母、盐、0卡糖、低脂牛奶、其他（面包体）、其他（馅料）,1,烘焙
抹茶和红丝绒的圣诞蛋糕卷,蛋黄、细砂糖A、牛奶、玉米油、低筋面粉、蛋白、细砂糖B、抹茶粉、红丝绒液、淡奶油、细砂糖C,8.3,烘焙
黑全麦吐司烫种➕波兰种（第二天吐司仍然柔软）,烫种、全麦粉、开水、波兰种、全麦粉、耐高糖干酵母、水、主要面团、高筋面粉、耐高糖干酵母、鸡蛋、盐、白砂糖、水（一定要预留水分）、黄油,0,烘焙
【蔓越莓绿豆糕】软绵好入口，不用烤箱就能做，老少皆宜,去皮绿豆、蔓越莓、黄油、盐、蜂蜜、糖,0,烘焙
8寸纯手工什锦披萨,马苏里拉芝士、高筋面粉、盐、糖、酵母粉、橄榄油或者玉米油、水,8.1,烘焙
视频菜谱:原味戚风蛋糕8寸戚风蛋糕不裂,鸡蛋、细砂糖、细砂糖、玉米油或色拉油、奶或水、低筋面粉、柠檬汁,8.9,烘焙
🔥日卖万盒👉椰香金沙咸蛋黄酥💥蛋黄控大爱‼️,低筋面粉、咸蛋黄、椰蓉、黄油、糖粉、小苏打粉、泡打粉、香草精、蛋黄、白酒,8.2,烘焙
杏仁奶香黄油曲奇,动物黄油（不可以植物黄油代替）、低筋面粉、细砂糖（幼砂糖不可以代替糖粉）、食用盐、纯牛奶（本身可以喝的纯牛奶）、杏仁粉（不可以其他代替）,1,烘焙
番茄鸡肉浓情焗饭【两人份】,鸡胸肉、胡萝卜、土豆、番茄、青椒、红椒、黑胡椒粉、生粉、番茄酱、盐、糖、酱油、洋葱、马苏里拉芝士碎,8.2,烘焙
绝密！8分钟，8块钱，吃8天的正宗欧包loaf来了！,面粉、盐（可根据自己喜好适量减少）、酵母、水,9.0,烘焙
蛋黄酥~紫薯、抹茶、原味~花好月圆，中秋快乐~内附一次做六色蛋黄酥方法~,中粉（普通面粉）、猪油、糖粉、水、低粉、猪油、紫薯粉、绿茶粉、鸭蛋黄、豆沙、蛋黄液、黑芝麻、大烤盘、油纸,8.6,烘焙
蛋黄溶豆专业版（解放双手）,蛋黄、奶粉、柠檬汁,4,烘焙
肉松沙拉酱面包（65度汤种）,汤种部分:、高筋面粉、水、面团部分:、高筋面粉、酵母、细砂糖、牛奶、水、盐、全蛋液、黄油、辣肉松、沙拉酱,8.6,烘焙
花生酥饼（无敌香酥松！）,花生、黄油、低筋面粉、糖、泡打粉、鸡蛋,8.2,烘焙
橙🍊香面包🍞,高筋粉、牛奶🥛、鸡蛋液、酵母、盐、黄油、细砂糖、橙子🍊皮屑、橙子🍊、三能水立方模,8.3,烘焙
操作简单，入口即化的玛格丽特小饼干😋,低筋面粉、玉米淀粉、糖粉、黄油、熟蛋黄、盐、奶粉（此方没有，增加奶香，可加可不加）,0,烘焙
无需打发的香葱苏打饼干,酵母、纯牛奶、低粉、色拉油、盐、小苏打、小香葱,1,烘焙
巧克力熔岩杯子蛋糕（不需打发）,黑巧克力、黄油、可可粉、鸡蛋、糖粉（放得很少，喜甜的可以30-40g）、低筋面粉、朗姆酒、小块黑巧克力（食指第一个关节大小）,8.2,烘焙
美味花生小小酥,低筋面粉、黄油、花生、糖粉、鸡蛋,8.0,烘焙
经典重芝士蛋糕,奶油奶酪、消化饼干、细砂糖、鸡蛋、玉米淀粉、柠檬汁、牛奶、朗姆酒、香草精、黄油,8.1,烘焙
紫米馅老婆饼超快手（不用出膜不用醒面）,水油皮、中筋面粉、白糖、猪油、沸水、油酥、低筋面粉、猪油、馅料、紫糯米馅、刷表面蛋黄,8.7,烘焙
港式吐司,高筋粉（金像)、糖、酵母、奶粉、盐、鸡蛋、黄油、牛奶,8.4,烘焙
肉松手撕面包—超软会爆浆的面包哟,高粉、低粉、水、牛奶、蛋液、糖、盐、酵母、黄油、奶粉,8.6,烘焙
好吃到跳脚的小热狗香肠面包,高筋面粉、牛奶、黄油、细砂糖、蛋液、酵母、盐、脆皮肠、欧芹碎、沙拉酱,0,烘焙
百香果慕斯,百香果汁、六寸戚风材料、鸡蛋、细砂糖、牛奶、玉米油、低筋面粉、柠檬汁、百香果慕斯层、淡奶油、糖粉、奶油奶酪、牛奶、吉利丁片（吉利丁粉等量）、朗姆酒（无可替代．不可少）,8.9,烘焙
完美复刻星巴克蘑菇头巧克力玛芬蛋糕,低筋面粉、黄油、法芙娜巧克力、鸡蛋液、耐高温巧克力豆、牛奶、酸奶、冰糖粉、泡打粉、小苏打、盐,2,烘焙
6寸，8寸，10寸戚风蛋糕配方（已更新）,6寸烤145度55分钟1：蛋黄糊、牛奶、玉米油、细砂糖、低粉、玉米淀粉、2：蛋白霜、柠檬汁、细砂糖~~~~~~~~~~~~~~~~~~、8寸烤145度60分钟、1：蛋黄糊、牛奶、玉米油、细砂糖、低粉、玉米淀粉、2：蛋白霜、柠檬汁、细砂糖、~~~~~~~~~~~~~~~~~~10寸烤155度60至65分钟、1：蛋黄糊、牛奶、玉米油、细砂糖、低粉、玉米淀粉、2：蛋白霜、柠檬汁、细砂糖,8.5,烘焙
奶香超浓郁的淡奶油吐司（消灭淡奶油）,高筋面粉、鸡蛋、淡奶油、盐、水、白砂糖、耐高糖酵母,8.5,烘焙
巴斯克芝士蛋糕,奶油奶酪250、细砂糖65、蛋黄1、全蛋2、香草精3、淡奶油110、柠檬汁12、玉米淀粉15,8.3,烘焙
入口即化火龙果蛋黄溶豆《六个月以上婴幼儿辅食零食》果蔬溶豆！无淀粉无糖简单配方更新,土鸡蛋蛋黄、配方奶粉（爱他美二段）、火龙果泥、柠檬汁,8.3,烘焙
奶香曲奇,黄油、白糖、鸡蛋、奶油、低筋面粉,1,烘焙
满口奶酪的紫米面包,白糖、紫米、奶酪、牛奶、糯米,8.1,烘焙
巧克力坚果脆脆,焦糖坚果、榛果、黄油、巧克力、蜂蜜、巧克力脆、蛋清、细砂糖、低筋面粉、可可粉、黄油,0,烘焙
美味蛋糕卷(精准到克数28×28金盘的量),牛奶、玉米油、蛋黄、蛋白、低筋面粉、细砂糖、玉米淀粉、28×28金盘,8.2,烘焙
空气炸锅做纸杯蛋糕,鸡蛋、低筋面粉、牛奶、玉米油、细砂糖,8.3,烘焙
一发纯奶手撕吐司面包（防止面团温度高的方法）,高粉、纯牛奶、炼奶、奶粉、鸡蛋、白糖、耐高糖酵母、盐、黄油,8.2,烘焙
风靡全国的爸爸糖手工吐司同款商业版制作配方及操作手法,高筋面粉、低筋面粉、全脂奶粉、砂糖、干酵母耐高糖、鸡蛋、全脂牛奶、水、盐、黄油、片状甜奶油,8.1,烘焙
小猪佩奇卡通造型炼奶饼干曲奇🐷新手友好，哄孩子必备,黄油、细砂糖（绵白糖，糖粉）、低筋面粉、炼奶,1,烘焙
抹茶蜜豆吐司,吐司粉、细砂糖、奶粉、鲜酵母或干酵母、淡奶油、蜂蜜、烫种、水、黄油、盐、抹茶、热水、红蜜豆、烫种、吐司粉、糖、盐、开水,8.4,烘焙
这才是葡式蛋挞！,鸡蛋黄、牛奶、淡奶油、细砂糖、盐、玉米淀粉,8.1,烘焙
蛋糕图,蛋,8.3,烘焙
每周必撸的软吐司,高筋面粉、牛奶、细砂糖、盐、蛋液、酵母、黄油,8.2,烘焙
无烤箱.奥利奥酸奶慕斯蛋糕🍰（六寸）家庭简易版.,无盐黄油、奥利奥饼干碎、吉利丁片、奶油芝士、酸奶、细砂糖、淡奶油,8.3,烘焙
美味快手的经典美帝巧克力软曲奇,无盐黄油、红糖、白糖、常温鸡蛋、小苏打粉、热水、盐、中筋面粉、黑巧克力豆、香草精,8.3,烘焙
奇亚籽蔓越莓全麦切达奶酪软欧,高筋面粉、全麦粉、颗粒燕麦、奇亚籽、糖、奶粉、冰水、酵母、盐、黄油、内陷、切达奶酪、蔓越莓干,1,烘焙
胖乎乎奶油芒果卷/不开裂不掉皮全过程详细图解烘焙视频/蛋糕篇6：「厚卷」,鸡蛋、白砂糖、低筋面粉、牛奶、植物油、淡奶油、白砂糖、芒果、香草精,8.5,烘焙
自制无添加披萨酱/意面酱,番茄、大蒜、洋葱、黄油、盐、黑胡椒粉（根据自己接受程度调整）、披萨草（干）（也叫牛至叶）【吃不惯可不放】、罗勒（干）、糖、牛肉馅儿（猪肉馅儿）、番茄膏（尽量不要省略，实在没有用番茄沙司，但风味会有变化）、生抽（拌肉）、玉米淀粉（拌肉）,9.0,烘焙
大理石纹抹茶乳酪慕斯蛋糕（冷藏式）,吉利丁片、牛奶（混合吉利丁片）、抹茶粉、白砂糖（混合抹茶粉）、牛奶（混合抹茶粉）、奶油奶酪、淡奶油、白砂糖（混合淡奶油）,0,烘焙
蔓越莓奶酥,黄油、蛋黄、蛋黄（刷面）、低筋面粉、奶粉、细砂糖,0,烘焙
玫瑰花面包,高筋粉、细砂糖、盐、酵母、鸡蛋、牛奶、淡奶油、黄油、装饰用、全蛋液,8.5,烘焙
新手必成8寸生日蛋糕（详细多图干货经验分享，解决戚风蛋糕塌陷，奶油饰面涂不好，烤箱温度不好掌握等各种问题）,鸡蛋、牛奶、低筋面粉、柠檬汁、细砂糖、细砂糖、细砂糖、玉米油、淡奶油、水果（草莓芒果菠萝蓝莓红色火龙果等）,8.1,烘焙
菠菜南瓜奶酪丹波面包丨健康·烘焙,"高筋面粉、盐、无铝泡打粉、无盐黄油（室温软化）、黑胡椒粉、孜然粒、全脂牛奶（室温）、菲达奶酪（feta,小块状的）、新鲜菠菜叶（生的，略切几刀不用切很碎）、南瓜（熟的，切小方块状的）",8.9,烘焙
零难度！蓝莓香蕉克拉芙缇,低筋面粉、鸡蛋、牛奶、杏仁粉（可不加）、糖、黄油、蓝莓、香蕉、糖粉,1,烘焙
超蓬松柔软🉐️奶香小面包如何发酵有详细说明、普通面粉也能做✌️,高筋面粉（普通面粉也🉑️）、白砂糖、盐、黄油（玉米油也🉑️）、温牛奶、酵母粉、鸡蛋、芝麻（没有可不放）,8.2,烘焙
香脆到掉渣的香烤馒头,馒头、黄油、白砂糖、炼乳,8.2,烘焙
自制肉松全网最简单的做法‼️家庭版视频讲解,瘦肉、生抽、老抽、盐、砂糖、食用油,8.2,烘焙
油酥烧饼(比麻酱烧饼更美味),中筋面粉、酵母粉（红燕）、细砂糖、食盐、植物油（无特殊气味）、清水、中筋面粉、植物油（无特殊气味）、食盐、五香粉,8.7,烘焙
全家都爱吃的健康全麦吐司，新手也能做,全麦粉、高筋粉、糖、奶粉、酵母、盐、鸡蛋、牛奶、黄油,8.1,烘焙
电饭煲蛋糕,鸡蛋、纯牛奶、白砂糖、面粉、食用油、葡萄干或水果干,8.4,烘焙
超软吐司简单快手手揉出膜技巧,高筋面粉、炼乳、牛奶、黄油、酵母、全蛋、细砂糖,8.2,烘焙
椰蓉吐司面包CoconutLoaf,高筋面包粉、牛奶、酵母粉、细砂糖、大鸡蛋、黄油、盐、黄油、细砂糖、椰丝、馅料里也可以加一个鸡蛋黄,8.6,烘焙
15分钟出炉的椰香酥软司康,低筋粉、细砂糖、泡打粉、椰子油（固态）、盐、淡奶油、椰蓉、鸡蛋液（抹面用）,1,烘焙
糯米粉版果酱夹心小蛋糕（无油）,糯米粉、鸡蛋、牛奶/水、糖、果酱,1,烘焙
恐龙蛋·麻薯面包·麻薯包自己做了1000➕的私人配方,麻薯粉、牛奶、鸡蛋、黄油、盐、芝麻,8.5,烘焙
奶油泡芙,低筋面粉、无盐黄油、鸡蛋、糖、盐、水、奶油夹心部分：、淡奶油、糖、香草精（没有可不放）,8.2,烘焙
有着面包口感的红糖馒头（一次发酵）,红糖、热水、耐高糖酵母、普通面粉、鸡蛋,8.6,烘焙
泡芙,无盐黄油40、低筋面粉、鸡蛋、海盐1、水100、糖、淡奶油、白砂糖20,0,烘焙
日式烧果子,蛋糕粉、蛋黄、炼乳、泡打粉、豆沙、巧克力,0,烘焙
火腿肉松芝士面包,盐、细砂糖、全脂奶粉、「风筝」高筋面粉、干酵母粉、全蛋液、纯牛奶、无盐黄油、火腿肠、肉松、马苏里拉芝士、香葱、沙拉酱,8.2,烘焙
卷不裂的蛋糕卷,玉米油、牛奶、低筋面粉、蛋黄、蛋白、细砂糖、淡奶油、奶油中的细砂糖,8.2,烘焙
自制8寸榴莲芝士披萨（简单好吃不输必胜客）,面粉（富强粉）、温水、酵母、糖、盐、植物油、奶油奶酪、榴莲泥、拉丝奶酪,8.2,烘焙
重芝士蛋糕6寸(一次成功),消化饼干、奶油奶酪、牛奶、黄油、鸡蛋2、细砂糖、玉米淀粉、柠檬汁,8.2,烘焙
面包机揉面烤箱烤出拉丝面包,新良面包粉、酵母、牛奶、白砂糖、鸡蛋、椰子油、盐,0,烘焙
巧克力牛角包,高筋面粉、鸡蛋、牛奶、糖粉、可可粉、淡奶油、酵母、盐、黄油、耐高温巧克力豆,8.0,烘焙
简便快捷-肉松小贝（吃到停不下来）,鸡蛋、牛奶、细砂糖、低筋面粉、玉米油、盐、肉松、沙拉酱,1,烘焙
莫尼卡美食厨房：爆浆巧克力蛋糕,鸡蛋、面粉、砂糖、黑巧克力、黄油、巧克力块,8.3,烘焙
教你做和KFC一样超级好吃的【葡式蛋挞】，吃了根本就停不下来吖,纯牛奶、淡奶油、细砂糖、炼乳、鸡蛋、蛋黄、蛋挞皮,8.6,烘焙
冻酸奶芝士蛋糕,奶油奶酪、酸奶、牛奶、消化饼干、蛋黄、吉利丁片、黄油、细砂糖、淡奶油、柠檬汁、朗姆酒,8.2,烘焙
古早味蛋糕（水浴法）,低筋面粉、砂糖、牛奶、植物油、蛋白、蛋黄、柠檬汁、盐,8.2,烘焙
零基础的人都可以制作的云石芝士,安佳乳酪、糖、鸡蛋、酸奶、奥利奥饼干碎、黄油,0,烘焙
减黄油减糖的曲奇饼干（简单快手.好吃不腻）,低筋面粉、无盐黄油、蛋黄（大个）、糖粉、糖粉（撒曲奇用）,8.1,烘焙
鸡蛋小饼干香酥脆小煎饼快手简单小饼干,鸡蛋、糖粉、玉米油、面粉,8.0,烘焙
自制奶酪棒（煮奶有妙招）,鲜牛奶、芝士片、糖、吉利丁片,0,烘焙
提拉米苏（巧克力海绵蛋糕版）,鸡蛋、细砂糖、低筋面粉、可可粉、咖啡粉、玉米油、吉利丁片、奶油奶酪、淡奶油、水,8.0,烘焙
柏翠面包机-超软拉丝吐司面包一次性发酵,高筋面粉、牛奶、鸡蛋、糖、盐、酵母、黄油（玉米油）、预留液体(牛奶或水),8.3,烘焙
原味蛋糕卷(后蛋法),鸡蛋、牛奶、玉米油、白砂糖、低筋面粉、柠檬汁或白醋,8.4,烘焙
媲美乳酪蛋糕的酸奶蛋糕,鸡蛋、玉米淀粉、低筋面粉、酸奶、玉米油、糖,0,烘焙
新疆果仁列巴,高筋面粉、细砂糖、鸡蛋、牛奶、淡奶油、黄油、酵母、食用盐、核桃仁、葡萄干或提子干、全蛋液,8.7,烘焙
萌小熊饼干,黄油、糖粉、蛋液、低筋面粉、可可粉,1,烘焙
简单又好吃的葡式蛋挞（6个量）,牛奶、蛋黄、奶油、糖、玉米淀粉,8.1,烘焙
网红脏蛋糕,鸡蛋（带壳65克+）、纯牛奶、色拉油、蛋黄用白砂糖、蛋白用白砂糖、低筋粉、可可粉、夹心和淋面、黑巧克力（甘那许）、淡奶油（甘那许）、淡奶油（淋面）、白砂糖（打发奶油）,8.6,烘焙
香喷喷的肉松面包卷，来试试吧！,高筋面粉、全蛋液、牛奶、细砂糖、盐、酵母、黄油、白芝麻，葱花，肉松，沙拉酱、全蛋液（刷表面）、28*28方盘,8.2,烘焙
超级酥松的蛋黄小饼干,蛋黄、糖粉、黄油、盐、低筋面粉、玉米淀粉,8.2,烘焙
蛋糕美图集合（搬运）,淡奶油、糖、水果,0,烘焙
面包糠炸虾,虾、淀粉、鸡蛋、面包糠、盐、白胡椒粉、料酒,8.7,烘焙
百吃不厌的奥利奥海盐蛋糕卷,蛋黄、蛋白、低粉、玉米油、牛奶、糖、可可粉、奥利奥海盐奶油、淡奶油、海盐、糖、奥利奥碎,8.2,烘焙
平底锅吐司培根披萨快手早餐,鸡蛋、吐司、马苏里拉、培根、豌豆、芝士粉,8.3,烘焙
AppleTart（苹果塔）,冷的无盐黄油、苹果、盐、奶油奶酪（creamcheese)、中筋面粉、香草精、柠檬汁、糖粉、肉桂粉、白糖A、鸡蛋、杏仁片、白糖B,8.3,烘焙
至尊披萨,高筋面粉、低筋面粉、酵母、白糖、盐、温水、橄榄油,7.9,烘焙
巧克力豆曲奇(ChocolateChipCookies),黄油、白糖、红糖、香草精、鸡蛋(或淡奶油)、耐烤巧克力豆、低筋面粉、法芙娜可可粉、小苏打、盐、装饰用耐烤巧克力豆,8.2,烘焙
玫瑰花黑加仑天然酵母,纯净水、黑加仑、蜂蜜、玫瑰花,1,烘焙
6寸慕斯蛋糕（巧克力味）,淡奶油、白糖、牛奶、吉利丁、蛋黄、可可粉、巧克力、饼干、黄油,8.1,烘焙
减脂全麦坚果面包,黑全麦面粉、高筋面粉、纯牛奶、红糖、玉米油、酵母、盐、每日坚果,8.2,烘焙
最好吃的吐司～70%中种北海道,高筋粉（中种）、即发干酵母、牛奶、蛋白、盐、高筋粉(主面团)、细砂糖、盐、淡奶油、橄榄油(原方黄油40克),8.7,烘焙
超软的~酸奶蛋糕,酸奶（浓稠的）、低筋面粉、玉米淀粉、鸡蛋、色拉油、糖、柠檬汁,7.8,烘焙
小美版牛奶面包卷,高筋面粉、糖、奶粉、耐高糖酵母、全蛋、淡奶油、牛奶、黄油、盐,8.2,烘焙
超简单的香蕉溶豆（无糖无奶粉版）,鸡蛋、香蕉泥、玉米淀粉,8.4,烘焙
牧羊人派,肉末、洋葱、大蒜、番茄、番茄酱、红酒、综合香草、现磨黑胡椒碎、盐/糖、食用油、大号马铃薯、黄油、牛奶、盐/胡椒粉、（1大勺=15ml，1小勺=5ml）、（调味料仅供参考，请根据自己口味调整）,8.6,烘焙
旺仔小馒头（无糖无盐）低龄版宝宝辅食系列,黄油、低筋面粉、玉米淀粉、奶粉、熟蛋黄、冲好的奶粉,8.1,烘焙
免揉云南玫瑰酱乡村软欧大面包,全麦粉、普通高筋面粉、云南滇红玫瑰酱、耐高糖酵母、清水、食盐、食用油、即食燕麦片/熟南瓜籽/生胡萝卜擦丝挤干水分,1,烘焙
淡奶油小面包（消耗奶油&不变硬面包）,高筋面粉、奶油、牛奶、鸡蛋、细砂糖、酵母、盐、蛋黄,8.1,烘焙
懒人红枣泥（红枣馅）可不用去皮、不加糖,红枣、水、玉米油,8.2,烘焙
全素无油低糖低脂南瓜欧包,高筋粉、南瓜、酵母、水、白砂糖、盐、可可粉,8.1,烘焙
八寸披萨饼皮（四个）制作,高筋面粉、低筋面粉、砂糖、酵母粉、黄油、盐、温水,8.4,烘焙
虎皮蛋糕卷（咸香款）,改良版戚风蛋糕：、全蛋、色拉油、鲜牛奶、低筋面粉、鸡蛋清、柠檬汁、玫瑰海盐、白砂糖、——————————、虎皮部分：、鸡蛋黄、白砂糖、色拉油、玉米淀粉、——————————、夹馅料部分：、丘比特沙拉酱,1,烘焙
拇指饼干（提拉米苏饼干）,鸡蛋60克左右的、白糖、柠檬汁、低筋面粉（蛋糕粉）,8.2,烘焙
翡翠白玉白菜饺子详细版（附翡翠白玉白菜饺子包法，翡翠白玉饺子皮两种制法，面包机和面，翡翠白玉烧卖，各种馅料搭配）,第一种馅料、白菜、猪肉、香菇、黑木耳、生抽、胡椒粉、现磨五香粉、现磨花椒粉）、料酒，香油、盐、糖、葱、姜、榨菜、鸡蛋、饺子粉、水、菠菜汁、第二种馅料：、第一种除猪肉的其他所有食材、迷迭香料、三文鱼、芥末酱、日本酱油、第三种馅料、西葫芦、香菇、蘑菇、猪肉、盐、生抽、糖、料酒、香油,8.6,烘焙
奶香蝴蝶结面包，软萌又可爱,高筋面粉、奶粉、糖、耐高糖酵母、盐、淡奶油、牛奶,2,烘焙
芒果慕斯蛋糕（8寸）,奥利奥饼干碎、黄油、淡奶油、芒果泥、白砂糖、牛奶、吉利丁片、芒果丁,1,烘焙
爆可爱的彩绘戚风蛋糕让你每一次的戚风蛋糕都让人惊叹连连！！超详细教程！！,画画糊、无盐黄油、糖粉、低筋面粉、蛋白、天然蔬果粉、竹炭粉、栀子蓝、栀子黄、红菊粉、今天图用到的颜色、原味戚风蛋糕、植物油、低筋面粉、蛋黄、牛奶、蛋白、柠檬汁、细糖、玉米淀粉,8.3,烘焙
自制手指饼干,鸡蛋、细砂糖、低筋面粉、玉米淀粉,8,烘焙
入口即化的古早味蛋糕（咸蛋黄/原味）,低筋面粉、玉米淀粉、牛奶、蛋黄、植物油、咸蛋黄（原味可不加）、蛋清、细砂糖、白醋或柠檬汁,8.2,烘焙
零失败芒果千层,芒果、牛奶、鸡蛋、黄油、糖、低筋面粉、玉米淀粉、淡奶油,8.1,烘焙
纵享丝滑🍫浓郁巧克力千层蛋糕滑又香,A常温牛奶、A低筋面粉、A糖粉、A黄油、A鸡蛋、A可可粉、B淡奶油、B细砂糖、B可可粉、B黑巧克力、C奶油、C黑巧克力,1,烘焙
干果磅蛋糕,西梅干、低筋粉、无盐黄油、微粒细砂糖、全蛋、泡打粉、蔓越莓干、杏子干、朗姆葡萄干、糖渍香橙干、核桃,8.6,烘焙
牛奶软面包,高筋面粉、奶粉、全蛋液、酵母、白糖、盐、牛奶、黄油,8.3,烘焙
拯救隔夜/干硬吐司！湿润香甜的【黄金炼乳吐司】,吐司、鸡蛋、牛奶、黄油、白砂糖、炼乳,0,烘焙
酥酥的黄油曲奇,无盐黄油、绵白糖（细砂糖）、生蛋黄、低筋面粉、盐,8.1,烘焙
【小嶋rumi】经典舒芙蕾乳酪蛋糕,奶油奶酪、黄油、蛋黄、砂糖、玉米淀粉、牛奶、蛋白、砂糖,8.7,烘焙
水果披萨,香蕉、火龙果、木瓜、苹果、芒果、椰果、水蜜桃罐头、菠萝罐头、沙拉酱、马苏里拉芝士、玉米粒、下面是面团的配比用料、糖、酵母粉、盐、黄油、水、面包粉,8.3,烘焙
浓郁巧克力慕斯蛋糕（6寸）,【蛋糕体】、6寸可可戚风、【慕斯液】、德芙黑巧共2条、淡奶油、糖粉、牛奶、吉利丁片2片、蛋黄（可不加）、朗姆酒、【表面装饰】、淡奶油、糖粉、法芙娜可可粉,8.3,烘焙
紫薯软吐司（可换算成南瓜、巧克力、抹茶口味）,高筋面粉、中号鸡蛋、牛奶、白砂糖、盐、奶粉、紫薯粉、新鲜酵母（干酵母）、温水（融化酵母用）、黄油,8.1,烘焙
抹茶兔兔曲奇（比熊猫简单！超详细实物图+超良心手绘图）,低筋面粉、糖粉（细砂糖也可）、无盐黄油、生蛋黄、抹茶粉、黑芝麻,8.1,烘焙
一次发酵❗️手撕吐司面包，柔软拉丝～,高筋面粉、奶粉、盐、耐高糖酵母、细砂糖、炼乳、黄油、全蛋液、牛奶、450克吐司盒*2,8.0,烘焙
巧克力熔岩蛋糕(全图文超简单),鸡蛋、低筋面粉、细砂糖、黄油、巧克力、朗姆酒,8.1,烘焙
