name,foods,score,kind
秒杀路边摊‼️巨好吃的爆炒花甲（花蛤）❗️十分钟搞定,花蛤蜊、葱、蒜蓉、豆瓣酱、调个酱汁：、料酒、生抽、老抽、蚝油、白糖、淀粉、水,0,下饭菜
锅包肉,土豆淀粉、里脊、白糖、料酒、盐、醋、姜、生抽、蒜末,2,下饭菜
简单好吃的鸡腿做法，不炒不炖口感超滑嫩，给年夜饭加道菜,鸡腿、香葱、姜、花椒、味极鲜、蚝油、醋、老抽、白芝麻、油、糖,8.1,下饭菜
超级简单美味的萝卜干咸菜,萝卜干、盐、糖、海鲜酱油、辣椒粉、芝麻、食用油、鸡精、蒜、姜、苹果梨,14,下饭菜
土豆烧鸡（非常下饭哦~）,鸡腿、土豆、葱姜蒜、干红辣椒、料酒、生抽、老抽、郫县豆瓣酱、冰糖、耗油、青椒,8.2,下饭菜
红烧带鱼,带鱼、红辣椒、香葱、姜、高度白酒、盐、生抽、老抽、香醋、白糖、盐、胡椒粉、（调味料请根据个人口味适当调整）、（1大勺=15ml，1小勺=5ml）,8.1,下饭菜
老公求我做的白菜肉沫粉丝，咸鲜可口，超级下饭,娃娃菜、粉丝、肉末、姜片、豆瓣酱、生抽、盐、糖、青红椒,7.9,下饭菜
老丁的私房菜-干锅花菜,花菜、五花肉、干辣椒、大蒜、青辣椒,7.8,下饭菜
明虾鸡爪煲（超入味）,明虾、鸡爪、土豆、洋葱、姜、葱、酱油、盐、料酒、蚝油、豆瓣酱,7.9,下饭菜
酸辣青椒烩豆皮,青椒、豆皮、生抽、醋、糖、葱花、食用油,0,下饭菜
不油腻还多汁的烤鸡翅,鸡翅、土豆、生抽、老抽、料酒、耗油、葱、姜、花椒、大蒜、盐,8.1,下饭菜
水煮肉片,辣椒碎、猪瘦肉、豆芽、大油菜、郫县豆瓣酱、花椒、干辣椒碎,8.1,下饭菜
铁板豆腐❗️万能灵魂酱料❗️秒杀街边小吃,豆腐、酱料配比、蒜蓉辣酱、蚝油、番茄酱、薄盐生抽、孜然粉、烧烤料、白糖、白芝麻、小香葱,0,下饭菜
蒜泥白肉,丹麦皇冠五花肉、青瓜、生姜、大蒜、花椒、葱、香菜、红油辣子（可不加）、花椒油、料酒、生抽、香醋、五花肉高汤、糖、鸡粉（可省略）、炒熟白芝麻,8.0,下饭菜
正宗麻婆豆腐「超详步骤图」,嫩豆腐、牛肉、生姜、小葱、大蒜、干辣椒、花椒、郫县红油豆瓣酱、永川豆豉、黑胡椒粉、白糖、料酒、生抽、淀粉、花椒油、辣椒油,8.2,下饭菜
新疆沙湾大盘鸡,土鸡、土豆、洋葱、青辣椒、大葱、干辣椒、花椒粉、白胡椒粉、五香粉、白糖、味精、盐、生姜末汁、蒜末汁、生抽、老抽,8.5,下饭菜
下饭菜肴--青椒酿肉,青椒、肉馅、鸡蛋、料酒、生抽、老抽、蚝油、葱姜蒜末、糖、淀粉、盐、鸡精、水,8.1,下饭菜
酸甜可口的糖醋鸡柳，关键是还很下饭！,鸡胸肉、鸡蛋、淀粉、黑胡椒粉、盐、料酒、白糖、香醋、番茄酱、清水,6,下饭菜
小炒秋葵,秋葵、姜、盐、生抽、香肠肉末,0,下饭菜
鸡油荠菜炒牛蛙,牛蛙、鸡油、荠菜、蚝油、盐、糖、黄酒、小葱,0,下饭菜
～夏天下饭菜～,黄瓜、秋葵、杭椒、小米辣、生抽、耗油、白糖、葱姜蒜八角花椒、醋,0,下饭菜
下饭菜～蒜苔肉末,蒜薹、猪肉糜、青椒、泡发的黑木耳、葱、郫县辣豆瓣酱、糖、老抽、生抽、鸡精,8.3,下饭菜
易上手的白切鸡（白斩鸡），蘸料很关键（附蘸料配方）,鸡、沙姜、香葱白、酱油、耗油、白糖、鸡精、盐、姜、八角,8,下饭菜
什锦玉米粒,甜玉米粒、青豆、胡萝卜、火腿、盐,7.9,下饭菜
豆芽韭菜炒鸡蛋，三分钟搞定～！,豆芽、韭菜、鸡蛋,2,下饭菜
地锅鸡--家常版,鸡、面粉、生姜、大蒜、洋葱、干辣椒、八角、桂皮、香叶、草寇、五仁辣椒油、青红椒、生抽、老抽、耗油、糖、大葱,13,下饭菜
重庆辣子鸡，全网最简单最正宗做法,鸡腿、鸡蛋、葱姜蒜、盐、胡椒粉、料酒、酱油,0,下饭菜
青椒肉丝,青椒、肉丝、蒜、老抽、盐、生抽,0,下饭菜
擂椒皮蛋—偷师学菜,皮蛋、青椒、蒜、香油、香醋、凉拌酱油、盐、糖,11,下饭菜
小米椒爆鸡胗,小米椒、鸡胗、大蒜、盐，生抽，黄酒,8.0,下饭菜
㊙️下饭利器❗️零失败家常版宫保鸡丁🔥,鸡胸肉、莴笋、胡萝卜、花生、葱姜蒜、花椒,0,下饭菜
尖椒小炒肉＃易上手“下饭香”,五花肉、尖椒、姜、大蒜、生抽、盐、白糖、醋、鸡精,0,下饭菜
农家小炒肉【记忆中勾魂的油汤】,湖南青椒、五花肉、蒜、油，盐，生抽，老抽,8.3,下饭菜
另类虎皮辣子,青椒、大蒜、生抽、糖、盐、油,0,下饭菜
简单易做的下饭菜－蒜苔炒肉,蒜苔、猪肉、酱油、盐、鸡精,4,下饭菜
超简单的菜可乐鸡翅,鸡中翅、可乐、生抽、料酒、老抽,8.0,下饭菜
东北烧茄子,茄子、尖椒、番茄、湿淀粉、酱汁配方、葱、姜末、大蒜、海鲜酱油、糖、鸡精、醋、蚝油、湿淀粉、清水、盐,8.5,下饭菜
家宴名品【清炖狮子头】,大葱、姜片、猪肉馅、蛋清、淀粉、盐、白砂糖、黑胡椒粉、蚝油、小青菜、水,0,下饭菜
水煮肉片：辣椒的盛宴,里脊肉、生菜、鸡蛋、葱、蒜、干辣椒、辣椒碎、辣椒面、花椒、豆瓣酱、料酒、生抽、芡粉、盐、糖,8.4,下饭菜
流油起沙的咸鸭蛋,土鸭蛋、纯净水、海盐、60°白酒,11,下饭菜
鲜嫩多汁照烧龙利鱼饭❗️吃一口停不下来😋,龙利鱼、葱、姜、生抽、糖、陈醋、料酒、黑胡椒碎、老抽、熟芝麻、海苔,12,下饭菜
快手照烧巴沙鱼盖饭,鱼、油、蒜、调料：、生抽、老抽、料酒、蚝油、蜂蜜、清水,8.2,下饭菜
超下饭的蒜苔肉末,蒜苔、瘦肉（带一丢丢肥肉）、姜末、淀粉、食盐、花椒粉、生抽、老抽、豆瓣酱、蚝油、料酒,7.9,下饭菜
黑椒杏鲍菇牛肉粒,牛里脊、杏鲍菇、杭椒、蒜、蚝油、料酒、生抽、老抽、黑胡椒粒、花生油,7.8,下饭菜
土豆烧排骨,排骨、土豆、姜、蒜、豆瓣、火锅底料、香油、花椒油、鸡精、味精、生抽、八角、香叶、桂皮,0,下饭菜
鱼香肉丝,里脊肉、青笋、黑木耳、老抽、盐、生抽、料酒、陈醋、白糖、水淀粉、泡辣椒(二荆条)、大葱、老姜、蒜头、菜籽油,0,下饭菜
【孕妇食谱】腊肉炒西芹，腊味十足、脆爽可口～,腊肉、西芹、胡萝卜、葱、姜、有机酱油,0,下饭菜
迷你狮子头,猪肉、鸡蛋、料酒、淀粉、生抽、老抽、姜、葱、八角,3,下饭菜
有点费米饭的芹菜炒肉,芹菜、猪肉、生抽、淀粉、老抽、生姜、干辣椒、料酒,15,下饭菜
美味剁椒（简单易做且可久存）,辣椒、盐、菜油、高度白酒、蒜末、细砂糖,14,下饭菜
茄子豆角,豆角、茄子、干辣椒、大蒜、蚝油、生抽、油,7.6,下饭菜
铁板酿茄🍆,茄子、肉碎、料酒（醃肉）、白胡椒粉（醃肉）、乾香菇、玉米澱粉（包裹茄子）、蒜蓉姜蓉、郫縣豆瓣醬、生抽、老抽、耗油、玉米澱粉（勾芡）、鹽、糖、料酒,0,下饭菜
夏日必备🥒爽口小黄瓜,小黄瓜、盐、辣椒油、糖、醋、酱油、鸡精、蒜片、姜片、葱段,1,下饭菜
香喷喷的黄焖鸡，学会再也不用点外卖啦,鸡、土豆、香菇、小葱、大蒜、生姜、青辣椒、红辣椒,7,下饭菜
辣子鸡丁,鸡腿、干辣椒或小米椒、花椒、生姜、大蒜、葱、胡椒粉、玉米淀粉、盐、豆瓣酱、生抽、油,1,下饭菜
潮汕炒薄壳（超简单）,薄壳、金不换、蒜、盐、油,1,下饭菜
家常菜~杏鲍菇烧牛肉粒,牛里脊肉肉、杏鲍菇、红椒、青椒、姜末、蒜末、蚝油、淀粉、香油、酱油、生抽、料酒、鸡精、黑胡椒粉、糖、盐,8.2,下饭菜
五花肉干锅茶树菇,五花肉、茶树菇、青椒、姜、蒜、干辣椒、生抽、盐、鸡精、老抽,8.1,下饭菜
蒜蓉蒸金针菇,海天海鲜酱油、海天蚝油、金针菇、蒜、香葱、色拉油、盐、糖,8.2,下饭菜
女友能吃三个馒头的下饭菜,杭椒、一号肉、鸡蛋、干辣椒,7.7,下饭菜
健康低卡家常菜—鲜虾炒西兰花,虾、西兰花、胡萝卜、大蒜、盐、蚝油,8.0,下饭菜
夏天的快手下饭菜,肉沫、酸腌菜、湘西外婆菜、豆干、葱、蒜、生抽、糖,0,下饭菜
青椒炒蛋米饭杀手下饭,食用油、青椒（细长型才够辣）、鸡蛋、蒜、生抽、老抽、盐,7.6,下饭菜
罗勒牛肉粒,牛肉碎、蒜、小米辣、泡姜（可不用）、罗勒、生抽、盐、糖、食用油,0,下饭菜
酱香茄子,长茄子、蒜、豆瓣酱、豆鼓、盐、蚝油、白砂糖、淀粉、青椒,0,下饭菜
干锅肥肠,猪大肠、青椒、黄瓜、青笋、胡萝卜、葱段、大蒜、生姜、花椒、干辣椒、泡姜、泡辣椒、盐、蚝油、老抽、白糖、味精,8.5,下饭菜
下饭菜-蒜苔香干肉沫,蒜苔、肉沫、香干、小米辣、姜末、蒜末、香葱、生抽、老抽、蚝油、糖、鸡精、盐、水淀粉,8.1,下饭菜
跟国宴大师学做—麻婆豆腐|麻辣鲜香的下饭神器，值得一学！,猪肉末、嫩豆腐、花椒、豆瓣酱、辣椒面、葱、姜、蒜,0,下饭菜
辣白菜懒人版,白菜、盐、白糖、苹果、秘制辣酱、姜末、蒜末、洋葱,9,下饭菜
爆炒猪肝家庭做法,猪肝、胡萝卜、尖椒、洋葱、姜、淀粉、生抽、老抽、蚝油、陈醋、糖、盐、食用油,3,下饭菜
鱼香肉丝,瘦肉、胡萝卜、木耳、青椒、泡椒、葱姜蒜沫、醋、白糖、豆瓣酱、料酒、酱油、清水、植物油、水淀粉、生粉,8.5,下饭菜
3分钟快手青椒炒牛肉，家庭版无盐无味精嫩香牛肉，我的常备菜单,牛肉、青椒、淀粉、糖、酱油、蒜、姜丝或姜末、辣椒🌶️、花椒、姜、植物油,8.1,下饭菜
酸辣豆角鸭胗,鸭胗、豆角、蒜、姜、青椒、酸笋、生抽、蚝油、老抽,0,下饭菜
每年必吃的爽口腌黄瓜,黄瓜、盐、酱油、白糖、蒜、姜、小米辣、鸡精、油、花椒,7.8,下饭菜
梅菜扣肉,五花肉、梅干菜、生抽、老抽、冰糖、八角、桂皮、葱姜、盐、油、白酒,8.3,下饭菜
水煮肉片SichuanBoiledSpicyPork,白菜叶、芹菜、猪里脊、淀粉、生抽酱油、料酒、陴县豆瓣酱、干辣椒、辣椒碎、花椒、大蒜、蒜苗、葱、姜,8.3,下饭菜
花菜炒肉,花菜、五花肉、干辣椒、青椒、大蒜、盐、酱油、蚝油,1,下饭菜
干煸四季豆,四季豆、猪肉末、干辣椒碎、花椒、葱花、料酒、生抽、盐、白糖、鸡精,7.7,下饭菜
照烧鸡翅（市售照烧汁版）,鸡翅、照烧汁、清水、熟白芝麻,8.1,下饭菜
一分钟教会你做“酿辣椒”,青椒、鱼泥、姜、盐、胡椒粉、生抽、蚝油、淀粉,0,下饭菜
麻辣香锅,五花肉、虾、香菇、金针菇、青笋、香芹、藕、辣椒、葱、姜、蒜、花椒、大料、桂皮、小茴香、火锅底料、郫县豆瓣、料酒、白糖,7.9,下饭菜
香辣牛肉,牛肉、生抽、蚝油、老抽、八角、盐、姜、蒜、五香粉、圆葱、葱花、香菜、香叶、陈皮、郫县豆瓣酱,0,下饭菜
肉末蒸豆腐,绢豆腐、肉泥、榨菜、油、生抽、盐、葱、姜,8.0,下饭菜
灯笼茄子,猪肉末、十三香、生抽、盐、茄子、淀粉、郫县豆瓣酱、白醋、白糖、鸡精、青红椒,7.9,下饭菜
生炒鸡下饭菜哦💯,鸡腿、青椒、料酒、盐、淀粉、葱、生姜、蒜、老抽、生抽、蚝油、糖、花椒,7.9,下饭菜
孜然火腿土豆丁,土豆、火腿肠、孜然粉,0,下饭菜
超下饭超简单的蒸肉饼,肉沫、生抽、酱油、盐、蚝油、白菜、虾皮、葱,5,下饭菜
农家一碗香,猪梅头肉、鸡蛋、螺丝椒、红辣椒、蒜、姜、豆豉、生抽、盐、糖、老抽、——腌肉料——、淀粉、白胡椒粉、盐、生抽、料酒、食用油,1,下饭菜
家庭版青椒酿肉,青椒、猪肉、蛋清、淀粉、葱沫、姜沫、蒜沫、盐、生抽、耗油、胡椒粉、黄酒,0,下饭菜
宫保鸡丁的家常做法，这个料汁一定要学会。（董姐美食）,鸡大胸、料酒、白胡椒粉、生抽、盐、淀粉、油、青红椒、花生米、葱姜蒜、小香葱、料汁、生抽、蚝油、醋、赤藓糖醇（或糖）、盐、水,0,下饭菜
油焖笋,春笋、酱油、糖、黄酒、盐、水,5,下饭菜
肉燥饭｜一条视频,五花肉、香菇、鸡蛋、老抽、生抽、黄冰糖、花雕、白胡椒粉、葱、姜,8.4,下饭菜
下饭菜红烧藕丁,莲藕、香菇、香肠、尖椒、葱、姜、蒜、生抽、老抽、蚝油、糖、盐、鸡精、五香粉,13,下饭菜
宫保鸡丁家常版,鸡胸肉、黄瓜、胡萝卜、辣椒、花生、蒜、姜、郫县豆瓣酱、调的酱汁：、料酒、生抽、蚝油、醋、白糖、淀粉,9,下饭菜
胡萝卜土豆炖排骨,排骨、土豆、胡萝卜、香叶、干辣椒、大料、桂皮、花椒、料酒、老抽、生抽、冰糖、热水,8.3,下饭菜
不放豆瓣酱的蚂蚁上树,带肥前腿肉、红薯粉丝、香菇、盐、生抽、耗油、葱姜蒜、麻辣鲜、小米辣,10,下饭菜
抖音网红百香果柠檬凤爪,鸡爪、洋葱、小米椒、柠檬、百香果、饮用水、芹菜、香菜、小葱、独蒜、醋(保宁醋)、生抽、老抽、白糖、盐、花椒油、姜片,7.9,下饭菜
💥颜色翠绿🙈满屋飘香💥超级下饭🔥🔥,豆角、葱、姜、蒜、花椒、干辣椒、盐、生抽、五香粉,11,下饭菜
肉沫豆角,长豆角、肉沫、生抽、蚝油,0,下饭菜
好吃下饭的酸菜鱼,海天下巴沙鱼柳200g、好人家酸菜鱼调料、香菜、小米椒、姜、花椒、黑胡椒粉、黄酒、芝麻、面粉,0,下饭菜
奥尔良烤鸡翅还没摆盘就被抢光了,鸡翅、奥尔良烤肉酱料、黑胡椒、蜂蜜,7.8,下饭菜
小鸡炖蘑菇,东北榛蘑、鸡肉、土豆粉条、葱、姜、蒜、八角、酱油（生抽，老抽混合汁）、料酒、盐、糖、香菜（备选）,8.3,下饭菜
超级下饭的橄榄菜肉末炒豆角（豇豆）,豇豆、肉末、橄榄菜、小米椒、大蒜、生抽、蚝油、盐,0,下饭菜
苍蝇头,韭菜苔、猪绞肉、朝天椒、姜、蒜、豆豉,8.4,下饭菜
红烧茄子烧土豆（好吃少油）,茄子、土豆、盐、酱油、耗油、洋葱、姜、蒜、冰糖、醋,8.2,下饭菜
吃了不胖的照烧鸡腿饭,鸡腿、生抽、料酒、蜂蜜、洋葱、干辣椒、熟黑芝麻、萵笋,0,下饭菜
青椒炒鸡，土豆炖鸡腿，家常炖鸡，下饭菜,青椒、糖、老抽、生抽、料酒、蚝油、淀粉、盐、大蒜、鸡腿、土豆、鸡精、甜酱、豆瓣酱、桂皮、姜、花椒、干辣椒、八角,0,下饭菜
宫保鸡丁,鸡胸肉、黄瓜、胡萝卜、花生、豆瓣酱、花椒、胡椒粉、料酒、生抽、盐、淀粉、白糖、蒜、干辣椒、鸡精,3,下饭菜
超级下饭菜-红油金针菇,金针菇、盐、糖、麻椒油、红油,8.5,下饭菜
口味鸭,鸭子、酒酿、八角、花椒、生姜、大蒜、干红辣椒、红辣椒（菜椒尖椒都可以）、老抽、盐,8.5,下饭菜
0失败肉蛋卷（鸡蛋卷）✌,鸡蛋、肉碎、葱、胡椒粉、盐、生抽、耗油、生粉、油,5,下饭菜
㊙️爆下饭的必备凉菜｜秘制酸辣爽脆腌黄瓜,黄瓜、干辣椒、蒜、姜、花椒、八角、盐、醋、生抽、老抽、蚝油、白糖,3,下饭菜
超级下饭的香辣牛肉酱,牛肉、甜面酱、黄豆酱、小米椒、料酒、大葱、蒜头、生姜、花椒、白糖、生抽、胡椒粉、鸡精、麻油、辣豆豉,8.4,下饭菜
鱼香茄子/豆腐（空气炸锅）,茄子、肉末、葱姜蒜末、红辣椒、盐、糖、醋、生抽、老抽、淀粉,13,下饭菜
韩式辣炒猪肉PorkBulgogi（SeonkyoungLongest菜谱）,猪肉片、韩国辣椒粉、味淋、鱼露、酱油、韩国浓缩青梅汁（可用杏酱或者苹果酱代替）、糖、黑胡椒粉、蒜、洋葱（大）、油、小葱、青/红椒（可不用）、芝麻、芝麻油,0,下饭菜
超级下饭的蒜蓉藕片,莲藕、大蒜、小米辣、生抽、蚝油、盐、香菜,3,下饭菜
湖南蛋,豆鼓、鸡蛋、葱、蒜、指天椒、油、盐,8.4,下饭菜
家常红烧鱼,六月鲜生抽、鲑鱼、蒜瓣、葱、姜片、花椒、红尖椒、香菜、糖,8.1,下饭菜
番茄烧茄子,西红柿、茄子、生抽、醋、蚝油、番茄酱、白糖、淀粉、清水、葱蒜末,1,下饭菜
比荤菜还好吃的超下饭神器！家常豆腐来啦～,老豆腐、木耳、青椒、胡萝卜、蒜、调料些许,2,下饭菜
超简单清爽可口的降酯菜－芹菜拌海米,芹菜、海米、盐、鸡精、香油,10,下饭菜
回锅肉,五花肉、郫县豆瓣酱、甜面酱、葱姜片、料酒、青蒜,7.7,下饭菜
剁椒鱼头，最正宗的做法，8分钟出锅，比饭店好吃一百倍，简单易学，全家都爱吃,鱼头、葱姜蒜、蒸鱼豉油、生抽、盐、蚝油、陈醋,7.9,下饭菜
超下饭鱼香肉丝,淀粉、木耳、胡萝卜、青椒、生抽、盐、料酒、醋、糖、老抽、猪瘦肉、泡椒小米辣、葱姜蒜,0,下饭菜
下饭神菜简单好吃零失败的红烧茄子🍆,茄子、生抽、蒜、小米辣、葱、蚝油、盐、鸡精、豆瓣酱,0,下饭菜
下饭神器蒜苔粒炒肉碎,肉末(猪肉/牛肉都可)、蒜苔、生抽、老抽、料酒、姜、蒜、豆瓣酱,0,下饭菜
香菇酿肉，一道细腻嫩滑好吃下饭菜！,新鲜香菇、肉末、葱、油、盐、生抽、蚝油、清水、淀粉,0,下饭菜
尖椒炒五花肉,五花肉、姜片、葱段、豆豉、豆瓣酱、尖椒、糖、鸡精、蚝油、蒜叶,7.8,下饭菜
超简单的家常下饭菜猪肉末辣炒豆角,豇豆角、猪肉（半肥瘦）、生抽、料酒、糖、蚝油、老抽、小米椒、蒜头、淀粉,9,下饭菜
三汁焖鱼,草鱼、青杭椒、红杭椒、红薯、海鲜菇、生姜、大蒜、香菜、洋葱、盐、生抽、老抽、黄豆酱、蚝油、白砂糖、醋、花椒、干辣椒、啤酒,13,下饭菜
豆腐西兰花鸡蛋羹,鸡蛋、西兰花、蒸鱼豉油、香油、豆腐,29,下饭菜
美味的肉酿香菇～～孩子爱吃的下饭菜,肉末、香菇、盐，生粉，生抽、鸡蛋、油，葱花、生菜叶,8.0,下饭菜
最“美”（肥美）不过六月黄,六月黄、姜片、大蒜、生抽、糯米手酿黄酒,0,下饭菜
烤茄子～秒杀夜市烧烤,小葱、蚝油、蒜、辣椒粉、茄子、孜然粉、生抽、花生油,6,下饭菜
美味大盘鸡,美味鲜酱油、三黄鸡、花椒、冰糖、豆瓣酱、郫县豆瓣酱、番茄酱、干辣椒、葱、姜片、八角、香叶、青椒：3-4个撕片儿，红尖椒（如果有）：2-3根切段儿、啤酒：1罐（易拉罐）,8.4,下饭菜
家常酸菜鱼,草鱼、花椒、酸菜、料酒、盐、泡椒、胡椒粉、蛋清、白砂糖、红辣子、姜末、蒜蓉、玉米油,8.1,下饭菜
超鲜炒虾（整虾秒剥壳）（内附保留整虾处理法）,料酒、姜、大蒜、活虾、生抽、蚝油、番茄沙司、玉米淀粉,12,下饭菜
超好吃的蒜苔炒肉,蒜苔、里脊肉、葱花,7,下饭菜
不用油炸，吃出肉味的红烧茄子,紫皮圆茄子、小米辣、大蒜、生抽、蚝油、白糖、老抽、淀粉,0,下饭菜
肉末毛豆烧臭豆腐,肉末、毛豆、臭豆腐、嫩豆腐、茭白、青/红辣椒、蒜末、姜片、生抽、蚝油、鱼露、香油,0,下饭菜
韭菜炒猪肝下饭菜,猪肝、韭菜、料酒、胡椒粉、生抽、盐、淀粉、葱、姜,8.6,下饭菜
浓香照烧黑椒鸡腿,琵琶腿、生抽、老抽、黑胡椒、盐、白糖、料酒、葱、洋葱,8.2,下饭菜
绝对下饭的笋干烧肉,笋干、五花肉、老抽、生抽、糖、料酒、盐、青蒜、葱、鸡精、十三香,11,下饭菜
可乐鸡翅（超简单）,鸡翅、可乐、姜、蒜、油、盐、酱油,0,下饭菜
红烧土豆,土豆、胡萝卜、香菇、盐、老抽、冰糖、八角,7.8,下饭菜
萝卜焖牛腩（好吃得可以摆摊了）,牛腩、萝卜、姜、葱白、料酒、蒜、生抽、老抽、白糖、耗油、陈皮,7.8,下饭菜
爆炒花甲,花甲、酱油、料酒、蒜、香菜、葱、辣椒、生姜,7.8,下饭菜
酒楼级别的蒸鱼方法，让你百吃不厌,鱼、葱、姜丝、蒸鱼豉油、食用油,0,下饭菜
干煸手撕杏鲍菇,杏鲍菇、大蒜、姜、辣椒粉、孜然粉、生抽或味极鲜酱油、盐、白糖、玉米油、芝麻,8.2,下饭菜
青菜银耳拌云丝/三色拌/清淡下饭菜/减肥餐,银耳、小油菜、云丝、盐、浅色酱油/薄盐生抽、醋、香油、炒熟白芝麻,0,下饭菜
香酥排骨蒸土豆,排骨、土豆、生姜、蒜头、料酒、生抽、老抽、蚝油、白糖、白胡椒粉、五香粉、淀粉、细盐,8.2,下饭菜
蛋饺,鸡蛋、盐、肉馅、香菜,5,下饭菜
零失误的红烧带鱼，经典家常菜，吃了就忘不掉的味道,带鱼、生抽、老抽、蚝油、香醋、料酒、白糖、花椒八角干辣椒、葱姜蒜、面粉,8.0,下饭菜
手撕搅拌杏鲍菇,杏鲍菇、蒜、香菜、葱、小米辣、辣椒粉、辣椒面、白芝麻、盐、鸡精、生抽、香醋、蚝油、糖、香油,6,下饭菜
超下饭的麻辣香锅（超详细步骤）,肉类、丸子类、虾、千张、油豆腐、蔬菜类、姜蒜洋葱香菜、干辣椒、麻辣香锅料包,8.2,下饭菜
红腐乳烧排骨,排骨、红腐乳汁、红腐乳、水、冰糖、生姜、生抽、料酒、油、葱、蒜,8.4,下饭菜
一分钟学会【番茄炒西葫芦】,西葫芦、番茄、生抽、盐、鸡精/味精、大蒜,7.9,下饭菜
鱼香茄子（试做）,茄子、葱、蒜、姜、白糖、醋、淀粉、生抽、酸海椒,0,下饭菜
懒人剁椒蒸鸡,土鸡、生姜、料酒、生抽、蚝油、剁辣椒、蒜、豆豉、葱花、芝麻油,0,下饭菜
鱼香茄子,茄子、郫县豆瓣酱、葱、蒜、香醋、生抽、盐、糖,7.8,下饭菜
玉米炒肉末【超级下饭的快手家常菜】,玉米、番茄、肉末、蒜、葱、生抽、盐、味精,8.1,下饭菜
下饭神器---老干妈炒香干,香干、榨菜、肉末、生姜、大蒜、尖椒、老干妈油辣椒、生抽、葱花、鸡精（可不加）、盐（可不加）,8.0,下饭菜
炒双笋,莴苣、小竹笋、木耳,7,下饭菜
第一次做就成功的番茄牛腩煲,牛腩、西红柿、土豆、葱、姜、蒜、八角、料酒、生抽、啤酒、芝麻葱花、深底铁锅一只、蕃茄酱,9,下饭菜
杭椒牛柳黑椒牛柳终于找到炒出嫩牛肉的办法了肉片肉丝都适用,牛肉（里脊肉）、青椒、生抽、盐、糖、老抽、蛋清、小苏打、姜水、水淀粉、生油、蚝油、生抽、清水、黑胡椒粉,8.2,下饭菜
【中餐厅】亮大厨教做宫保鸡丁『多图详解』,主料、鸡胸肉、黄瓜、花生米（炸过的）、辅料、豆瓣酱、辣椒、花椒、蒜、姜、葱、张亮微博官方酱汁、生抽酱油、白糖、米醋、勺子是平时吃饭用的,8.0,下饭菜
超级下饭菜～酱扒茄子,茄子、蒜、淀粉、黄豆酱/黄酱/东北大酱、豆瓣酱、盐、酱油、蚝油、花椒粉、清水,6,下饭菜
梅菜扣肉,五花肉、梅干菜、白糖、八角、桂皮，香叶、老抽、生抽、胡椒粉、料酒,1,下饭菜
藤椒酸汤鱼——吃辣人士不可错过,蒜、葱、酸汤鱼调料、金针菇、魔芋结、内酯豆腐嫩豆腐、粉丝、龙利鱼/黑鱼/带刺的鱼/不带刺的鱼,0,下饭菜
地三鲜,土豆、青椒、茄子、生抽、盐、糖、水淀粉,7.6,下饭菜
西红柿炖牛腩-汤汁浓厚，牛肉软烂，做法详细,牛腩肉、西红柿、葱、姜、炖肉香料、啤酒、冰糖、用时,14,下饭菜
豆腐火腿菇,海鲜菇或者蟹味菇、鸡蛋、火腿、豆腐、小葱、淀粉、香油、盐,6,下饭菜
洋葱炒肉,洋葱、鸡胸肉（猪肉也可以）、盐、蚝油、味极鲜（酱油也可以）、孜然粉（粗一点的）（不喜欢可以不放）、油,1,下饭菜
蟹黄豆腐（咸蛋黄版）,内脂豆腐、熟咸蛋黄、蟹肉棒、豌豆粒、玉米淀粉、水/高汤、盐,7.7,下饭菜
🔥🔥香到灵魂深处的【简易版】牛肉手抓饭🍛上桌马上抢光‼️,安格斯谷饲上脑牛排、胡萝卜、杏鲍菇、洋葱、生抽、盐、糖,4,下饭菜
咖喱鸡饭,鸡腿、咖喱、胡萝卜、土豆、青豆、洋葱,8.3,下饭菜
小美·香菇炒毛豆,毛豆去皮、香菇切丁、生抽、老抽、蒜、油、红尖椒切丁、蚝油、冰糖、淀粉,0,下饭菜
超级下饭的秋葵小炒肉,五花肉、秋葵、小辣椒、蒜、姜、郫县豆瓣酱、生抽、盐、淀粉、料酒、姜粉、白糖,8.1,下饭菜
孜然羊肉,羊肉、孜然粉、孜然粒、盐、味极鲜酱油、辣椒粉,9,下饭菜
孜然三样,鸡蛋、香肠、平菇、盐、孜然粉,0,下饭菜
咸蛋烧豆腐～～孩子爱吃的下饭菜！,咸鸭蛋、嫩豆腐、火腿肠、蒜苗或葱、淀粉、清水,7.8,下饭菜
酸辣藕丁,鲜藕、青椒、干红辣椒、生姜、小葱,7.5,下饭菜
超级无敌的下饭菜―青椒木耳炒腐竹,腐竹、青椒、红椒、木耳、西红柿、鸡蛋、淀粉、大葱、蒜头、生姜、干辣椒、料酒、蚝油、鸡精、生抽、湿淀粉、食用油,3,下饭菜
红烧肉,五花肉、冰糖、生抽、醋、八角、桂皮、花椒、姜片、盐、植物油、水,8.2,下饭菜
十分钟搞定秘制番茄金针菇肥牛卷,金针菇、肥牛、番茄、生抽、十三香、白糖、番茄酱、蒜瓣,13,下饭菜
〈蒜苔炒八爪鱼〉，味道绝对可以。欣小厨😉,章鱼、蒜苔、盐、酱油、鸡精,8,下饭菜
